{
  "schema_version": "profile_intake.v1",
  "equipment": {
    "gyms": [
      {
        "gym_id": "blocx",
        "name": "Blocx",
        "equipment": ["hangboard", "gym_boulder", "weight"]
      }
    ]
  },
  "availability": {
    "mon": {
      "evening": {
        "available": true,
        "preferred_location": "gym",
        "gym_id": "blocx"
      }
    }
  },
  "planning_prefs": {
    "target_training_days_per_week": 4,
    "hard_day_cap_per_week": 3,
    "default_gym_id": "blocx"
  },
  "defaults": {
    "location": "home"
  },
  "context": {
    "location": "gym",
    "gym_id": "blocx"
  }
}
